{
  "$schema": "http://json-schema.org/draft-07/schema#",
  "$id": "goal_profile.schema.json",
  "title": "Goal Profile",
  "description": "A weighted priority vector across modalities, plus the phase sequence and prerequisites needed to generate a complete training program for a given objective.",
  "type": "object",
  "required": ["id", "name", "priorities", "primary_sources", "phase_sequence"],
  "additionalProperties": false,
  "properties": {
    "id": {
      "type": "string",
      "pattern": "^[a-z0-9_]+$",
      "description": "Unique slug. e.g. 'alpine_climbing', 'bjj_competitor', 'general_gpp'"
    },
    "name": {
      "type": "string",
      "description": "Human-readable name. e.g. 'Alpine Climbing Performance'"
    },
    "description": {
      "type": "string",
      "description": "One or two sentences describing who this goal profile is for and what outcome it targets."
    },
    "event_date": {
      "type": ["string", "null"],
      "format": "date",
      "description": "ISO date of the target event, if applicable. Drives taper timing and total program length. null if open-ended.",
      "default": null
    },
    "priorities": {
      "type": "object",
      "description": "Weighted priority vector across modalities. Values should sum to 1.0. The scheduler uses these weights to allocate session slots.",
      "propertyNames": {
        "enum": [
          "max_strength", "strength_endurance", "relative_strength",
          "aerobic_base", "anaerobic_intervals", "mixed_modal_conditioning",
          "power", "mobility", "movement_skill", "durability",
          "combat_sport", "rehab"
        ]
      },
      "additionalProperties": { "type": "number", "minimum": 0, "maximum": 1 },
      "examples": [{
        "aerobic_base": 0.50,
        "max_strength": 0.15,
        "durability":   0.20,
        "mobility":     0.10,
        "power":        0.05
      }]
    },
    "primary_sources": {
      "type": "array",
      "description": "Philosophy IDs that govern this goal profile. When philosophies conflict, the first listed takes priority.",
      "items": { "type": "string" },
      "minItems": 1
    },
    "phase_sequence": {
      "type": "array",
      "description": "Ordered meso-level phases from program start to event. Defines the periodization structure.",
      "minItems": 1,
      "items": {
        "type": "object",
        "required": ["phase", "weeks", "focus"],
        "additionalProperties": false,
        "properties": {
          "phase": {
            "type": "string",
            "enum": ["base", "build", "peak", "taper", "deload", "maintenance", "rehab", "post_op"],
            "description": "Phase type. Maps to training phase in constraint schema."
          },
          "weeks": {
            "type": "integer",
            "minimum": 1,
            "description": "Duration of this phase in weeks."
          },
          "focus": {
            "type": "string",
            "description": "Free text description of what this phase emphasizes. e.g. 'aerobic_base + strength_endurance'"
          },
          "priority_override": {
            "type": "object",
            "description": "If set, temporarily overrides the top-level priority vector during this phase.",
            "additionalProperties": { "type": "number", "minimum": 0, "maximum": 1 }
          }
        }
      }
    },
    "minimum_prerequisites": {
      "type": "object",
      "description": "Minimum benchmark values an athlete must meet before this program starts. Keys are benchmark IDs; values are the minimum acceptable score.",
      "additionalProperties": {
        "oneOf": [
          { "type": "number" },
          { "type": "string" }
        ]
      },
      "default": {},
      "examples": [{
        "run_5km_time_min": 35,
        "back_squat_bw_pct": 0.85
      }]
    },
    "incompatible_with": {
      "type": "array",
      "description": "Goal profile IDs that cannot be run concurrently with this one. The system should warn if both are requested.",
      "items": {
        "type": "object",
        "required": ["goal_id", "reason"],
        "additionalProperties": false,
        "properties": {
          "goal_id": { "type": "string" },
          "reason":  { "type": "string" }
        }
      },
      "default": []
    },
    "framework_selection": {
      "type": "object",
      "description": "Which framework to use by default, and under what conditions alternatives are acceptable.",
      "properties": {
        "default_framework": {
          "type": "string",
          "description": "Framework ID to use unless overridden."
        },
        "alternatives": {
          "type": "array",
          "items": {
            "type": "object",
            "required": ["framework_id", "condition"],
            "additionalProperties": false,
            "properties": {
              "framework_id": { "type": "string" },
              "condition":    { "type": "string", "description": "When to use this framework instead. e.g. 'days_per_week <= 3'" }
            }
          }
        }
      },
      "additionalProperties": false
    },
    "notes": { "type": "string" },
    "expectations": {
      "type": "object",
      "description": "Timeline and session structure expectations for this goal profile.",
      "properties": {
        "min_weeks":             { "type": "integer", "minimum": 1 },
        "ideal_weeks":           { "type": "integer", "minimum": 1 },
        "min_days_per_week":     { "type": "integer", "minimum": 1, "maximum": 7 },
        "ideal_days_per_week":   { "type": "integer", "minimum": 1, "maximum": 7 },
        "min_session_minutes":   { "type": "integer", "minimum": 1 },
        "ideal_session_minutes": { "type": "integer", "minimum": 1 },
        "supports_split_days":          { "type": "boolean" },
        "ideal_long_session_minutes":   { "type": "integer", "minimum": 1 },
        "notes":                        { "type": "string" }
      },
      "additionalProperties": false
    }
  }
}
