[
  {
    "id": "alpine_climbing",
    "name": "Alpine Climbing Performance",
    "description": "For mountain athletes preparing for technical or high-altitude alpine objectives. Targets a strong aerobic engine, load-bearing durability, and sufficient strength to move efficiently under a pack in steep terrain over multi-day efforts.\n",
    "event_date": null,
    "priorities": {
      "aerobic_base": 0.5,
      "durability": 0.2,
      "max_strength": 0.15,
      "mobility": 0.1,
      "power": 0.05
    },
    "primary_sources": [
      "uphill_athlete",
      "horsemen_gpp",
      "kelly_starrett"
    ],
    "phase_sequence": [
      {
        "phase": "base",
        "weeks": 8,
        "focus": "Build aerobic base (Zone 1–2 volume), establish structural strength (3×5 squat/deadlift/press), introduce daily mobility practice and joint prep. Low intensity, high frequency aerobic work.\n"
      },
      {
        "phase": "build",
        "weeks": 6,
        "focus": "Increase aerobic volume and vertical gain. Add pack weight to rucks. Introduce threshold intervals (1–2×/week). Strength transitions from linear load to moderate volume sets. Begin movement complexity on terrain.\n",
        "priority_override": {
          "aerobic_base": 0.45,
          "durability": 0.25,
          "max_strength": 0.15,
          "mobility": 0.1,
          "power": 0.05
        }
      },
      {
        "phase": "peak",
        "weeks": 4,
        "focus": "Shift toward sport-specific simulation: long rucks with max pack weight, sustained threshold and lactate intervals, reduce strength volume to maintenance. Mental durability work. Sharpening power-to-weight.\n",
        "priority_override": {
          "aerobic_base": 0.4,
          "durability": 0.3,
          "power": 0.15,
          "mobility": 0.1,
          "max_strength": 0.05
        }
      },
      {
        "phase": "taper",
        "weeks": 2,
        "focus": "Reduce volume 40–50%, maintain intensity. Short aerobic sessions, mobility, movement quality. No new strength stimulus. Full recovery entering objective.\n",
        "priority_override": {
          "aerobic_base": 0.4,
          "mobility": 0.3,
          "durability": 0.2,
          "max_strength": 0.05,
          "power": 0.05
        }
      }
    ],
    "minimum_prerequisites": {
      "run_5km_time_min": 35,
      "back_squat_bw_pct": 0.85,
      "pull_up_reps": 3
    },
    "incompatible_with": [
      {
        "goal_id": "max_strength_focus",
        "reason": "High-volume barbell strength work creates CNS and recovery interference with the aerobic volume required for alpine prep. Concurrent pursuit degrades both adaptations.\n"
      }
    ],
    "framework_selection": {
      "default_framework": "polarized_80_20",
      "alternatives": [
        {
          "framework_id": "concurrent_training",
          "condition": "days_per_week <= 3"
        },
        {
          "framework_id": "block_periodization",
          "condition": "event_date is not null and weeks_to_event >= 16"
        }
      ]
    },
    "notes": "Uphill Athlete's polarized model is the primary driver: 80% Zone 1–2, 20% above aerobic threshold. Strength work from Horsemen/SS provides the structural base for load-bearing. Starrett mobility protocols protect hip, ankle, and thoracic integrity under extended pack loads. Vertical gain and time-on-feet trump gym PRs as the relevant performance metric.\n",
    "expectations": {
      "min_weeks": 14,
      "ideal_weeks": 20,
      "min_days_per_week": 3,
      "ideal_days_per_week": 5,
      "min_session_minutes": 45,
      "ideal_session_minutes": 75,
      "ideal_long_session_minutes": 210,
      "supports_split_days": true,
      "notes": "Weekend long efforts (3–5h hikes or ruck marches) are non-negotiable for alpine prep. Weekday sessions are shorter strength and aerobic work (60–90 min). Secondary sessions (joint prep, foot/ankle work) pair well with primary days.\n"
    }
  },
  {
    "id": "bjj_competitor",
    "name": "BJJ Competitor",
    "description": "For Brazilian Jiu-Jitsu competitors preparing for a tournament or sharpening competitive fitness. Prioritizes mat-time conditioning (isometric endurance, hip explosiveness, grip endurance), complementary strength, and the joint health required to sustain heavy training loads.\n",
    "event_date": null,
    "priorities": {
      "combat_sport": 0.3,
      "strength_endurance": 0.2,
      "mobility": 0.2,
      "max_strength": 0.15,
      "anaerobic_intervals": 0.15
    },
    "primary_sources": [
      "bjj",
      "ido_portal",
      "gym_jones",
      "kelly_starrett",
      "marcus_filly"
    ],
    "phase_sequence": [
      {
        "phase": "base",
        "weeks": 6,
        "focus": "Build aerobic and structural foundation. 3–4 BJJ sessions/week (drilling and positional sparring, no full intensity rounds). Barbell strength 2×/week (squat, deadlift, press). Dedicated mobility 20–30 min daily for hips, shoulders, and neck. Grip endurance work begins (dead hangs, towel pull-ups).\n"
      },
      {
        "phase": "build",
        "weeks": 6,
        "focus": "Increase conditioning specificity. Hard rolling 3–4×/week. Introduce anaerobic intervals (Tabata, sprint intervals) 1–2×/week to match match intensity. Strength endurance circuits (KB complexes, bodyweight). Hip explosiveness training (broad jumps, med ball, Litvinov). Grip density work.\n",
        "priority_override": {
          "combat_sport": 0.35,
          "strength_endurance": 0.25,
          "anaerobic_intervals": 0.2,
          "mobility": 0.15,
          "max_strength": 0.05
        }
      },
      {
        "phase": "peak",
        "weeks": 3,
        "focus": "Tournament-specific sharpening. Hard rounds at match pace 4–5×/week. Anaerobic intervals at match duration (5–6 min rounds). Drop strength volume to maintenance. Increase mobility and recovery work. Sharpen takedown and guard retention conditioning.\n",
        "priority_override": {
          "combat_sport": 0.45,
          "anaerobic_intervals": 0.25,
          "mobility": 0.2,
          "strength_endurance": 0.1,
          "max_strength": 0.0
        }
      },
      {
        "phase": "taper",
        "weeks": 1,
        "focus": "Reduce volume 50%+. Light drilling only, no hard rolling. Full mobility session. Rest, recovery, mental preparation. Weight cut management if applicable.\n",
        "priority_override": {
          "mobility": 0.5,
          "combat_sport": 0.3,
          "strength_endurance": 0.2,
          "max_strength": 0.0,
          "anaerobic_intervals": 0.0
        }
      }
    ],
    "minimum_prerequisites": {
      "pull_up_reps": 5,
      "run_1mile_min": 10
    },
    "incompatible_with": [],
    "framework_selection": {
      "default_framework": "concurrent_training",
      "alternatives": [
        {
          "framework_id": "block_periodization",
          "condition": "event_date is not null and weeks_to_event >= 12"
        },
        {
          "framework_id": "rpe_autoregulation",
          "condition": "bjj_sessions_per_week >= 5"
        }
      ]
    },
    "notes": "Mat time is non-transferable; rolling has no substitute (BJJ philosophy). Gym Jones block structure governs off-mat conditioning phases. Kelly Starrett protocols govern shoulder, knee, and neck maintenance — critical given the compression and torque demands of grappling. Marcus Filly RPE autoregulation prevents overtraining when BJJ volume is high. Joint health for shoulders, knees, and neck must be actively maintained throughout; any pain flags redirect training immediately.\n",
    "expectations": {
      "min_weeks": 12,
      "ideal_weeks": 16,
      "min_days_per_week": 3,
      "ideal_days_per_week": 5,
      "min_session_minutes": 45,
      "ideal_session_minutes": 60,
      "supports_split_days": true,
      "notes": "BJJ-specific conditioning requires moderate weekly frequency alongside mat training. Short sessions (45 min) are viable. Secondary mobility sessions are highly recommended given the shoulder, neck, and knee stress of grappling.\n"
    }
  },
  {
    "id": "general_gpp",
    "name": "General Physical Preparedness",
    "description": "For athletes who want broad, balanced fitness with no single domain weakness. Targets a rolling program that develops strength, aerobic capacity, work capacity, and movement quality concurrently — the foundation for any future specialization or sport-specific pivot.\n",
    "event_date": null,
    "priorities": {
      "max_strength": 0.2,
      "aerobic_base": 0.2,
      "strength_endurance": 0.2,
      "durability": 0.15,
      "mobility": 0.15,
      "power": 0.1
    },
    "primary_sources": [
      "horsemen_gpp",
      "crossfit",
      "wildman_kettlebell",
      "marcus_filly",
      "kelly_starrett"
    ],
    "phase_sequence": [
      {
        "phase": "base",
        "weeks": 8,
        "focus": "Establish all-domain foundation simultaneously. Linear barbell progression 3×/week (squat, press, deadlift). Zone 2 aerobic 3×/week. KB ballistic technique (swing, clean, snatch). Daily joint prep circuit. No intensity work until movement quality is established.\n"
      },
      {
        "phase": "build",
        "weeks": 8,
        "focus": "Increase load, volume, and conditioning density. Transition to 5×5 strength. Add threshold intervals 1×/week. Introduce GPP circuits (sandbag, loaded carries, bodyweight) 2×/week. KB pentathlon volume begins. EMOM density work.\n",
        "priority_override": {
          "strength_endurance": 0.25,
          "max_strength": 0.2,
          "aerobic_base": 0.2,
          "durability": 0.2,
          "power": 0.1,
          "mobility": 0.05
        }
      },
      {
        "phase": "deload",
        "weeks": 1,
        "focus": "Full deload. All volumes cut 50%. Movement quality focus only. No max efforts. Active recovery, joint prep, light Zone 2. Mental reset.\n",